id,object,result_position,cid,internal_review_id,is_user_local_guide,lang,origin,place_id,place_name,published_at,published_at_datetime,pictures,place_average_score,review_link,response_from_owner,score,text,total_likes,total_reviews,user_name,user_link,user_internal_id,user_reviews_count,user_image_url,visited_in,zero_x,collected_at,input_url,input_sort_by,input_language
"8041459","result","278","12385137861630555461","ChdDSUhNMG9nS0VJQ0FnSUNScU56enNRRRAB","f","vi","Google","ChIJLaTZ6I_XdDERRfW6EETZ4Ks",,"a year ago","2023-03-24 00:09:06.047589+00","","2.9","https://www.google.com/maps/reviews/data=!4m8!14m7!1m6!2m5!1sChdDSUhNMG9nS0VJQ0FnSUNScU56enNRRRAB!2m1!1s0x0:0xabe0d94410baf545!3m1!1s2@1:CIHM0ogKEICAgICRqNzzsQE%7CCgsIotTzoAYQiM3YFg%7C?hl=en","","3","Please correct the hospital cashier's way of speaking, the attitude is too uncultured, unqualified, the conversation is too rude.","4","956","Ho Christ","https://www.google.com/maps/contrib/102766989167672740826?hl=en","102766989167672740826","7","https://lh3.googleusercontent.com/a-/ALV-UjVhBhlC3sF0783TwU9MS9mWKzeI2kd4Tir7_FE-AprxBisMLOJRqw=s120-c-rp-mo-br100",,"0x0:0xabe0d94410baf545","2024-05-03 10:03:40.861179+00","https://www.google.com/maps/place/Becamex+International+Hospital/@10.9040943,106.5656015,12z/data=!4m12!1m2!2m1!1zYuG7h25oIHZp4buHbiBiw6xuaCBkxrDGoW5n!3m8!1s0x3174d78fe8d9a42d:0xabe0d94410baf545!8m2!3d10.9040943!4d106.7097971!9m1!1b1!15sChti4buHbmggdmnhu4duIGLDrG5oIGTGsMahbmdaHSIbYuG7h25oIHZp4buHbiBiw6xuaCBkxrDGoW5nkgEIaG9zcGl0YWyaASRDaGREU1VoTk1HOW5TMFZKUTBGblNVUmxORGd5UW1oQlJSQULgAQA!16s%2Fg%2F11fm7f7c8k?entry=ttu","most_relevant","English (United States)"
"8041460","result","279","12385137861630555461","ChdDSUhNMG9nS0VJQ0FnSUN1cjd5Ymp3RRAB","f","vi","Google","ChIJLaTZ6I_XdDERRfW6EETZ4Ks",,"a year ago","2022-08-09 11:03:57.787538+00","","2.9","https://www.google.com/maps/reviews/data=!4m8!14m7!1m6!2m5!1sChdDSUhNMG9nS0VJQ0FnSUN1cjd5Ymp3RRAB!2m1!1s0x0:0xabe0d94410baf545!3m1!1s2@1:CIHM0ogKEICAgICur7ybjwE%7CCgwInf7IlwYQ0MDD9wI%7C?hl=en","","3","The hospital is big and clean, but the waiting time is long. In addition, the patient has a bad attitude and is afraid of going to a public hospital, spending money to go to a private hospital and in the end it's no different.","3","956","Sơn Long","https://www.google.com/maps/contrib/108146031409168917274?hl=en","108146031409168917274","1","https://lh3.googleusercontent.com/a/ACg8ocJqHiuc5m5c1N-yyUdBEH_nKHfvBHNjATE05Rtq98jgLcstKg=s120-c-rp-mo-br100",,"0x0:0xabe0d94410baf545","2024-05-03 10:03:41.605927+00","https://www.google.com/maps/place/Becamex+International+Hospital/@10.9040943,106.5656015,12z/data=!4m12!1m2!2m1!1zYuG7h25oIHZp4buHbiBiw6xuaCBkxrDGoW5n!3m8!1s0x3174d78fe8d9a42d:0xabe0d94410baf545!8m2!3d10.9040943!4d106.7097971!9m1!1b1!15sChti4buHbmggdmnhu4duIGLDrG5oIGTGsMahbmdaHSIbYuG7h25oIHZp4buHbiBiw6xuaCBkxrDGoW5nkgEIaG9zcGl0YWyaASRDaGREU1VoTk1HOW5TMFZKUTBGblNVUmxORGd5UW1oQlJSQULgAQA!16s%2Fg%2F11fm7f7c8k?entry=ttu","most_relevant","English (United States)"
"8041461","result","280","12385137861630555461","ChZDSUhNMG9nS0VJQ0FnSURrdGFDUkh3EAE","f","vi","Google","ChIJLaTZ6I_XdDERRfW6EETZ4Ks",,"4 years ago","2019-07-03 03:04:59.751517+00","","2.9","https://www.google.com/maps/reviews/data=!4m8!14m7!1m6!2m5!1sChZDSUhNMG9nS0VJQ0FnSURrdGFDUkh3EAE!2m1!1s0x0:0xabe0d94410baf545!3m1!1s2@1:CIHM0ogKEICAgIDktaCRHw%7CCgwI27bw6AUQyPqs5gI%7C?hl=en","","1","The doctor of foreign clinic 3 impolitely chased away the patient's family members. The cashier counter staff in lobby B showed an unwelcoming attitude and gestured with their hands instead of telling customers to submit their tickets. Only saw a few enthusiastic security guards. Perhaps the more educated you are, the more arrogant your attitude becomes. As for the quality of medical examination and treatment, it is still a question mark. The hospital needs to change its service attitude (Doctors...) to deserve the name ""INTERNATIONAL HOSPITAL"".","13","956","AN VO THI","https://www.google.com/maps/contrib/116918381853478278054?hl=en","116918381853478278054","1","https://lh3.googleusercontent.com/a-/ALV-UjXp9Rgc5DfAQ5CI1WnsB8gfFrWuRCrgh4pX5ZHXU0lm_NRkFHpw=s120-c-rp-mo-br100",,"0x0:0xabe0d94410baf545","2024-05-03 10:03:42.294572+00","https://www.google.com/maps/place/Becamex+International+Hospital/@10.9040943,106.5656015,12z/data=!4m12!1m2!2m1!1zYuG7h25oIHZp4buHbiBiw6xuaCBkxrDGoW5n!3m8!1s0x3174d78fe8d9a42d:0xabe0d94410baf545!8m2!3d10.9040943!4d106.7097971!9m1!1b1!15sChti4buHbmggdmnhu4duIGLDrG5oIGTGsMahbmdaHSIbYuG7h25oIHZp4buHbiBiw6xuaCBkxrDGoW5nkgEIaG9zcGl0YWyaASRDaGREU1VoTk1HOW5TMFZKUTBGblNVUmxORGd5UW1oQlJSQULgAQA!16s%2Fg%2F11fm7f7c8k?entry=ttu","most_relevant","English (United States)"
"8041462","result","281","12385137861630555461","ChdDSUhNMG9nS0VJQ0FnSURtdi1ITmhBRRAB","f","vi","Google","ChIJLaTZ6I_XdDERRfW6EETZ4Ks",,"2 years ago","2022-02-14 04:04:34.183581+00","","2.9","https://www.google.com/maps/reviews/data=!4m8!14m7!1m6!2m5!1sChdDSUhNMG9nS0VJQ0FnSURtdi1ITmhBRRAB!2m1!1s0x0:0xabe0d94410baf545!3m1!1s2@1:CIHM0ogKEICAgIDmv-HNhAE%7CCgsI0qmnkAYQyPLEVw%7C?hl=en","","1","Employee Ton Thi Thom February 14 at 10, had an angry attitude towards customers threaten, if the customer does not gently and beg, he will not register for medical examination I was very upset, so I asked the employee to call the department manager to talk. This manager, along with the staff, also bullied me Tell me to go home, don't accept my medical examination This service is so bad, the manager has to listen to what the customer has to say about why they are upset It's not natural that when I go to see a doctor, I get angry at the staff","12","956","Vinh Ly","https://www.google.com/maps/contrib/100192850934271852158?hl=en","100192850934271852158","1","https://lh3.googleusercontent.com/a-/ALV-UjVE4qavA2KifnlkNu269asAHfMzbhKDMn2fgRhThap6yEBekpk=s120-c-rp-mo-br100",,"0x0:0xabe0d94410baf545","2024-05-03 10:03:43.249406+00","https://www.google.com/maps/place/Becamex+International+Hospital/@10.9040943,106.5656015,12z/data=!4m12!1m2!2m1!1zYuG7h25oIHZp4buHbiBiw6xuaCBkxrDGoW5n!3m8!1s0x3174d78fe8d9a42d:0xabe0d94410baf545!8m2!3d10.9040943!4d106.7097971!9m1!1b1!15sChti4buHbmggdmnhu4duIGLDrG5oIGTGsMahbmdaHSIbYuG7h25oIHZp4buHbiBiw6xuaCBkxrDGoW5nkgEIaG9zcGl0YWyaASRDaGREU1VoTk1HOW5TMFZKUTBGblNVUmxORGd5UW1oQlJSQULgAQA!16s%2Fg%2F11fm7f7c8k?entry=ttu","most_relevant","English (United States)"
"8041463","result","282","12385137861630555461","ChZDSUhNMG9nS0VJQ0FnSURPMzluSldREAE","f","vi","Google","ChIJLaTZ6I_XdDERRfW6EETZ4Ks",,"a year ago","2022-07-17 21:49:09.171176+00","","2.9","https://www.google.com/maps/reviews/data=!4m8!14m7!1m6!2m5!1sChZDSUhNMG9nS0VJQ0FnSURPMzluSldREAE!2m1!1s0x0:0xabe0d94410baf545!3m1!1s2@1:CIHM0ogKEICAgIDO39nJWQ%7CCgsI1YfSlgYQwODPUQ%7C?hl=en","Chào bạn, rất tiếc về trải nghiệm chưa tốt của bạn tại Bệnh viện. Bạn có thể gọi đường dây nóng 0274 3 681 681 (phím1) để phản ánh chi tiết vấn đề của bạn. Bệnh viện sẽ tiếp nhận, xác minh và phản hồi. Mọi góp ý của bạn sẽ góp phần nâng cao chất lượng dịch vụ. Xin cảm ơn.","1","The hospital is airy, the facilities are unquestionable BUT the doctor's attitude is too bad, paying money is not begging but the doctor talks like a superior to the patient. I've heard a lot about the attitude of doctors here before, but I don't believe it. Anyone who experiences it will see that it's true. I'll never go back.","6","956","Gia Mooh","https://www.google.com/maps/contrib/106095492470960239438?hl=en","106095492470960239438","2","https://lh3.googleusercontent.com/a-/ALV-UjV0eF31VF9n0VBg_Ruc8kE3DEx_Xl69_8BlvJLlyy0BPoU64qIU=s120-c-rp-mo-br100",,"0x0:0xabe0d94410baf545","2024-05-03 10:03:43.546741+00","https://www.google.com/maps/place/Becamex+International+Hospital/@10.9040943,106.5656015,12z/data=!4m12!1m2!2m1!1zYuG7h25oIHZp4buHbiBiw6xuaCBkxrDGoW5n!3m8!1s0x3174d78fe8d9a42d:0xabe0d94410baf545!8m2!3d10.9040943!4d106.7097971!9m1!1b1!15sChti4buHbmggdmnhu4duIGLDrG5oIGTGsMahbmdaHSIbYuG7h25oIHZp4buHbiBiw6xuaCBkxrDGoW5nkgEIaG9zcGl0YWyaASRDaGREU1VoTk1HOW5TMFZKUTBGblNVUmxORGd5UW1oQlJSQULgAQA!16s%2Fg%2F11fm7f7c8k?entry=ttu","most_relevant","English (United States)"
"8041464","result","283","12385137861630555461","ChZDSUhNMG9nS0VJQ0FnSURlM2NQdkZBEAE","f","vi","Google","ChIJLaTZ6I_XdDERRfW6EETZ4Ks",,"a year ago","2022-10-17 12:34:14.693312+00","","2.9","https://www.google.com/maps/reviews/data=!4m8!14m7!1m6!2m5!1sChZDSUhNMG9nS0VJQ0FnSURlM2NQdkZBEAE!2m1!1s0x0:0xabe0d94410baf545!3m1!1s2@1:CIHM0ogKEICAgIDe3cPvFA%7CCgwIxpe1mgYQgLTMygI%7C?hl=en","","1","Service attitude is quite poor. I came to need advice on general medical examination services. When I got to the guidance counter, they told me to call the switchboard. When I call, I can't give you a bunch of numbers. In the afternoon, when I went back to ask the female staff at the counter for advice, they were angry. They took out my phone to ask for advice and made an appointment. They couldn't even call, so they turned around and yelled at me. 3-4 people bullied me and the consultant through the switchboard when I called. Having an international name seems like an attitude of losing to people in the market.","3","956","-Nhân Hoàng","https://www.google.com/maps/contrib/102252728355047257224?hl=en","102252728355047257224","1","https://lh3.googleusercontent.com/a/ACg8ocIgfUIndAHXhxMCo00jvTBtdZELq5HBaa3lIkXTMrkt16vhKw=s120-c-rp-mo-br100",,"0x0:0xabe0d94410baf545","2024-05-03 10:03:43.865248+00","https://www.google.com/maps/place/Becamex+International+Hospital/@10.9040943,106.5656015,12z/data=!4m12!1m2!2m1!1zYuG7h25oIHZp4buHbiBiw6xuaCBkxrDGoW5n!3m8!1s0x3174d78fe8d9a42d:0xabe0d94410baf545!8m2!3d10.9040943!4d106.7097971!9m1!1b1!15sChti4buHbmggdmnhu4duIGLDrG5oIGTGsMahbmdaHSIbYuG7h25oIHZp4buHbiBiw6xuaCBkxrDGoW5nkgEIaG9zcGl0YWyaASRDaGREU1VoTk1HOW5TMFZKUTBGblNVUmxORGd5UW1oQlJSQULgAQA!16s%2Fg%2F11fm7f7c8k?entry=ttu","most_relevant","English (United States)"
"8041465","result","284","12385137861630555461","ChdDSUhNMG9nS0VJQ0FnSUNPLV9DMmdRRRAB","f","vi","Google","ChIJLaTZ6I_XdDERRfW6EETZ4Ks",,"a year ago","2022-06-21 01:05:58.593128+00","","2.9","https://www.google.com/maps/reviews/data=!4m8!14m7!1m6!2m5!1sChdDSUhNMG9nS0VJQ0FnSUNPLV9DMmdRRRAB!2m1!1s0x0:0xabe0d94410baf545!3m1!1s2@1:CIHM0ogKEICAgICO-_C2gQE%7CCgwI9rLElQYQwNTpmgI%7C?hl=en","Chào bạn, Bạn có thể nói rõ hơn chỗ người nhà BN là vị trí nào không ạ? Hoặc bạn vui lòng gọi đường dây nóng 0271 3 681681 (phím 1) để góp ý chi tiết ạ. Cảm ơn bạn nhiều.","1","International hospital with poor service from the guidance team. When a patient goes to see a doctor, they only go to the patient's family. When asked questions, push responsibility.","6","956","Diễm Nguyễn","https://www.google.com/maps/contrib/107012828767339299298?hl=en","107012828767339299298","1","https://lh3.googleusercontent.com/a-/ALV-UjW02qdEAIqb7Jp6eob82qq46diPZmDM4H7i_3QrFacnnVK7s9Ev=s120-c-rp-mo-br100",,"0x0:0xabe0d94410baf545","2024-05-03 10:03:44.14237+00","https://www.google.com/maps/place/Becamex+International+Hospital/@10.9040943,106.5656015,12z/data=!4m12!1m2!2m1!1zYuG7h25oIHZp4buHbiBiw6xuaCBkxrDGoW5n!3m8!1s0x3174d78fe8d9a42d:0xabe0d94410baf545!8m2!3d10.9040943!4d106.7097971!9m1!1b1!15sChti4buHbmggdmnhu4duIGLDrG5oIGTGsMahbmdaHSIbYuG7h25oIHZp4buHbiBiw6xuaCBkxrDGoW5nkgEIaG9zcGl0YWyaASRDaGREU1VoTk1HOW5TMFZKUTBGblNVUmxORGd5UW1oQlJSQULgAQA!16s%2Fg%2F11fm7f7c8k?entry=ttu","most_relevant","English (United States)"
"8041466","result","285","12385137861630555461","ChZDSUhNMG9nS0VJQ0FnSUNDOXJTbUNBEAE","t","vi","Google","ChIJLaTZ6I_XdDERRfW6EETZ4Ks",,"3 years ago","2020-08-22 02:25:03.377684+00","","2.9","https://www.google.com/maps/reviews/data=!4m8!14m7!1m6!2m5!1sChZDSUhNMG9nS0VJQ0FnSUNDOXJTbUNBEAE!2m1!1s0x0:0xabe0d94410baf545!3m1!1s2@1:CIHM0ogKEICAgICC9rSmCA%7CCgwI_4OC-gUQoICMtAE%7C?hl=en","","5","I went to the doctor twice and felt satisfied with the service and attitude of everyone here. I was examined at the Department of Internal Medicine and found that the examination schedule was flexible and there were many doctors, so I didn't have to wait long. Doctor Diep was attentive and polite in his examination. Endoscopy services are diverse and with clear and encouraging advice from the staff and nurses, I was able to overcome the feeling of discomfort. Service prices are also reasonable and equipment is modern. Thank you hospital for being present in Binh Duong.","4","956","Quyen Ngo","https://www.google.com/maps/contrib/106770416372599832246?hl=en","106770416372599832246","98","https://lh3.googleusercontent.com/a-/ALV-UjVc8Cj7yjwZeNl2JP3mLWZsq1LoDRsR-OLxQlE--3CQByAyDVVi=s120-c-rp-mo-ba4-br100",,"0x0:0xabe0d94410baf545","2024-05-03 10:03:44.403329+00","https://www.google.com/maps/place/Becamex+International+Hospital/@10.9040943,106.5656015,12z/data=!4m12!1m2!2m1!1zYuG7h25oIHZp4buHbiBiw6xuaCBkxrDGoW5n!3m8!1s0x3174d78fe8d9a42d:0xabe0d94410baf545!8m2!3d10.9040943!4d106.7097971!9m1!1b1!15sChti4buHbmggdmnhu4duIGLDrG5oIGTGsMahbmdaHSIbYuG7h25oIHZp4buHbiBiw6xuaCBkxrDGoW5nkgEIaG9zcGl0YWyaASRDaGREU1VoTk1HOW5TMFZKUTBGblNVUmxORGd5UW1oQlJSQULgAQA!16s%2Fg%2F11fm7f7c8k?entry=ttu","most_relevant","English (United States)"
"8041467","result","286","12385137861630555461","ChdDSUhNMG9nS0VJQ0FnSUNocUo2cnpnRRAB","t","vi","Google","ChIJLaTZ6I_XdDERRfW6EETZ4Ks",,"a year ago","2023-02-04 04:16:49.856259+00","","2.9","https://www.google.com/maps/reviews/data=!4m8!14m7!1m6!2m5!1sChdDSUhNMG9nS0VJQ0FnSUNocUo2cnpnRRAB!2m1!1s0x0:0xabe0d94410baf545!3m1!1s2@1:CIHM0ogKEICAgIChqJ6rzgE%7CCgwIsbj3ngYQuPOlmAM%7C?hl=en","","2","Went for a prenatal checkup but waited until noon until I had an ultrasound at an international hospital","0","956","Huutuan Tran","https://www.google.com/maps/contrib/103955752458521259513?hl=en","103955752458521259513","25","https://lh3.googleusercontent.com/a-/ALV-UjUC-2IJwdnEtr5j_N74d2GTz64HDPUPa8eGws0kLjy4ysdKzfzF=s120-c-rp-mo-ba3-br100",,"0x0:0xabe0d94410baf545","2024-05-03 10:03:44.668088+00","https://www.google.com/maps/place/Becamex+International+Hospital/@10.9040943,106.5656015,12z/data=!4m12!1m2!2m1!1zYuG7h25oIHZp4buHbiBiw6xuaCBkxrDGoW5n!3m8!1s0x3174d78fe8d9a42d:0xabe0d94410baf545!8m2!3d10.9040943!4d106.7097971!9m1!1b1!15sChti4buHbmggdmnhu4duIGLDrG5oIGTGsMahbmdaHSIbYuG7h25oIHZp4buHbiBiw6xuaCBkxrDGoW5nkgEIaG9zcGl0YWyaASRDaGREU1VoTk1HOW5TMFZKUTBGblNVUmxORGd5UW1oQlJSQULgAQA!16s%2Fg%2F11fm7f7c8k?entry=ttu","most_relevant","English (United States)"
"8041468","result","287","12385137861630555461","ChdDSUhNMG9nS0VJQ0FnSUR5eUxXVy1nRRAB","f","vi","Google","ChIJLaTZ6I_XdDERRfW6EETZ4Ks",,"3 years ago","2021-02-22 11:06:07.471441+00","","2.9","https://www.google.com/maps/reviews/data=!4m8!14m7!1m6!2m5!1sChdDSUhNMG9nS0VJQ0FnSUR5eUxXVy1nRRAB!2m1!1s0x0:0xabe0d94410baf545!3m1!1s2@1:CIHM0ogKEICAgIDyyLWW-gE%7CCgwI6aDOgQYQuNH55AI%7C?hl=en","Chào bạn, rất tiếc về trải nghiệm chưa tốt của bạn tại Bệnh viện. Bạn vui lòng gọi đường dây nóng 0274 3 681 681 (phím1) để phản ánh chi tiết vấn đề của bạn. Bệnh viện sẽ tiếp nhận, xác minh và phản hồi cho bạn. Xin cảm ơn!","1","The emergency department misdiagnosed my mother's illness. When I took her to the doctor, it was after working hours so I went to the emergency department. My mother was tired, achy, and had red pimples like a rash. She went in to see my mother. When I asked for blood to be tested to see what was wrong, the doctor refused and gave me a false diagnosis, 99% certain it was chickenpox. But my body did not have a single blister. After taking the medicine, he lay paralyzed in one place. Ng was walking around the hospital, took the medicine the doctor prescribed, then went back to lie down on the spot. So I wonder how the hospital does business? I thought my mother wouldn't survive. Luckily, she was taken to another hospital in time, not in critical condition. In the end, the doctor diagnosed that my mother was allergic to Becamex hospital's medicine. What happened? Becamex hospital? But doing business so poorly? While the illness is mild, the diagnosis becomes severe. Anyone who intends to go to the doctor should stay away from this hospital. Putting your trust in the wrong place is life-threatening. If the emergency department does business, sooner or later someone will die unjustly.","7","956","Hà Nguyễn","https://www.google.com/maps/contrib/104867363498719055360?hl=en","104867363498719055360","1","https://lh3.googleusercontent.com/a-/ALV-UjWH-RxNswpApo1cAHfvl-wjBJ_WusPG03C7KtfK2wAGoTT2QYEWtg=s120-c-rp-mo-br100",,"0x0:0xabe0d94410baf545","2024-05-03 10:03:44.932689+00","https://www.google.com/maps/place/Becamex+International+Hospital/@10.9040943,106.5656015,12z/data=!4m12!1m2!2m1!1zYuG7h25oIHZp4buHbiBiw6xuaCBkxrDGoW5n!3m8!1s0x3174d78fe8d9a42d:0xabe0d94410baf545!8m2!3d10.9040943!4d106.7097971!9m1!1b1!15sChti4buHbmggdmnhu4duIGLDrG5oIGTGsMahbmdaHSIbYuG7h25oIHZp4buHbiBiw6xuaCBkxrDGoW5nkgEIaG9zcGl0YWyaASRDaGREU1VoTk1HOW5TMFZKUTBGblNVUmxORGd5UW1oQlJSQULgAQA!16s%2Fg%2F11fm7f7c8k?entry=ttu","most_relevant","English (United States)"
"8041469","result","288","12385137861630555461","ChdDSUhNMG9nS0VJQ0FnSUQtcF9feG1BRRAB","f","vi","Google","ChIJLaTZ6I_XdDERRfW6EETZ4Ks",,"a year ago","2022-12-11 13:51:02.712377+00","","2.9","https://www.google.com/maps/reviews/data=!4m8!14m7!1m6!2m5!1sChdDSUhNMG9nS0VJQ0FnSUQtcF9feG1BRRAB!2m1!1s0x0:0xabe0d94410baf545!3m1!1s2@1:CIHM0ogKEICAgID-p__xmAE%7CCgwIxsDXnAYQqIXY0wI%7C?hl=en","","1","My child has a fever! My wife had a fever when she went to take care of the children, so she asked for an extra slot to take care of the mother and child, but the doctor made it too difficult. No one wants to go to the hospital and lie around! Haizzz","3","956","Nguyen Kim Ninh","https://www.google.com/maps/contrib/117320420299441304864?hl=en","117320420299441304864","8","https://lh3.googleusercontent.com/a-/ALV-UjUY3FSpHx2Q51blst7q6bIA4sp8R1xJfyDoD4Rh5VQqdy9qcD1u=s120-c-rp-mo-br100",,"0x0:0xabe0d94410baf545","2024-05-03 10:03:45.261135+00","https://www.google.com/maps/place/Becamex+International+Hospital/@10.9040943,106.5656015,12z/data=!4m12!1m2!2m1!1zYuG7h25oIHZp4buHbiBiw6xuaCBkxrDGoW5n!3m8!1s0x3174d78fe8d9a42d:0xabe0d94410baf545!8m2!3d10.9040943!4d106.7097971!9m1!1b1!15sChti4buHbmggdmnhu4duIGLDrG5oIGTGsMahbmdaHSIbYuG7h25oIHZp4buHbiBiw6xuaCBkxrDGoW5nkgEIaG9zcGl0YWyaASRDaGREU1VoTk1HOW5TMFZKUTBGblNVUmxORGd5UW1oQlJSQULgAQA!16s%2Fg%2F11fm7f7c8k?entry=ttu","most_relevant","English (United States)"
"8041470","result","289","12385137861630555461","ChdDSUhNMG9nS0VJQ0FnSURsOU9LWThBRRAB","f","vi","Google","ChIJLaTZ6I_XdDERRfW6EETZ4Ks",,"5 months ago","2023-11-30 14:22:41.301137+00","","2.9","https://www.google.com/maps/reviews/data=!4m8!14m7!1m6!2m5!1sChdDSUhNMG9nS0VJQ0FnSURsOU9LWThBRRAB!2m1!1s0x0:0xabe0d94410baf545!3m1!1s2@1:CIHM0ogKEICAgIDl9OKY8AE%7CCgwIsbWiqwYQ6PjLjwE%7C?hl=en","","5","Fast, good service, dedicated doctor","0","956","Thảo Nguyễn","https://www.google.com/maps/contrib/101710475824516945764?hl=en","101710475824516945764","2","https://lh3.googleusercontent.com/a-/ALV-UjUkflSpGTXaD1pJJ6hJoYSt6C1JeRY563rIw3Kz7WdqiJr8Zu33=s120-c-rp-mo-br100",,"0x0:0xabe0d94410baf545","2024-05-03 10:03:45.610707+00","https://www.google.com/maps/place/Becamex+International+Hospital/@10.9040943,106.5656015,12z/data=!4m12!1m2!2m1!1zYuG7h25oIHZp4buHbiBiw6xuaCBkxrDGoW5n!3m8!1s0x3174d78fe8d9a42d:0xabe0d94410baf545!8m2!3d10.9040943!4d106.7097971!9m1!1b1!15sChti4buHbmggdmnhu4duIGLDrG5oIGTGsMahbmdaHSIbYuG7h25oIHZp4buHbiBiw6xuaCBkxrDGoW5nkgEIaG9zcGl0YWyaASRDaGREU1VoTk1HOW5TMFZKUTBGblNVUmxORGd5UW1oQlJSQULgAQA!16s%2Fg%2F11fm7f7c8k?entry=ttu","most_relevant","English (United States)"
"8041471","result","290","12385137861630555461","ChZDSUhNMG9nS0VJQ0FnSUMwbGNQeVh3EAE","f","vi","Google","ChIJLaTZ6I_XdDERRfW6EETZ4Ks",,"4 years ago","2019-10-05 03:10:17.73032+00","","2.9","https://www.google.com/maps/reviews/data=!4m8!14m7!1m6!2m5!1sChZDSUhNMG9nS0VJQ0FnSUMwbGNQeVh3EAE!2m1!1s0x0:0xabe0d94410baf545!3m1!1s2@1:CIHM0ogKEICAgIC0lcPyXw%7CCgwI3Iu48AUQsPCVxgI%7C?hl=en","","2","Just get vaccinated and always have enough medicine. As for treatment, it's frustrating for an internationally renowned hospital. Bringing in a 6 month old baby with a milk allergy, taking a vein and testing her arm would crush her. Anyone who gets an injection to draw blood but sticks it in but doesn't see any blood, then pulls out half the needle and then stabs it in another direction, stabbing it in 5 places like that and finally gets blood. Looking at it, I want to take my child home immediately. The staff is still unskilled. Being admitted to the hospital for 2 days is mainly for selling services, but when I finally leave the hospital I don't know what the blood test results are","2","956","Trường Võ","https://www.google.com/maps/contrib/100600359418988523985?hl=en","100600359418988523985","11","https://lh3.googleusercontent.com/a-/ALV-UjUE9YFchtz9dThu0TWCDnexgNNFU-9V3Ejz0eu63OnGBfIzPCEB=s120-c-rp-mo-br100",,"0x0:0xabe0d94410baf545","2024-05-03 10:03:45.905379+00","https://www.google.com/maps/place/Becamex+International+Hospital/@10.9040943,106.5656015,12z/data=!4m12!1m2!2m1!1zYuG7h25oIHZp4buHbiBiw6xuaCBkxrDGoW5n!3m8!1s0x3174d78fe8d9a42d:0xabe0d94410baf545!8m2!3d10.9040943!4d106.7097971!9m1!1b1!15sChti4buHbmggdmnhu4duIGLDrG5oIGTGsMahbmdaHSIbYuG7h25oIHZp4buHbiBiw6xuaCBkxrDGoW5nkgEIaG9zcGl0YWyaASRDaGREU1VoTk1HOW5TMFZKUTBGblNVUmxORGd5UW1oQlJSQULgAQA!16s%2Fg%2F11fm7f7c8k?entry=ttu","most_relevant","English (United States)"
"8041472","result","291","12385137861630555461","ChdDSUhNMG9nS0VJQ0FnSUMwajhfOXNRRRAB","f","vi","Google","ChIJLaTZ6I_XdDERRfW6EETZ4Ks","Becamex International Hospital","4 years ago","2019-07-12 09:05:44.119733+00","https://lh5.googleusercontent.com/p/AF1QipO-UloROlYTzp0xICPVM2xTD-dloiHIE5ufVclG, https://lh5.googleusercontent.com/p/AF1QipMwykidGqXLW7wrdgcu0JhhoYRlRwCR4meBE-Po, https://lh5.googleusercontent.com/p/AF1QipMt0TGkCQxH7uF_Jg0f8Voqy3tq2kF-SW0Kh0L8","2.9","https://www.google.com/maps/reviews/data=!4m8!14m7!1m6!2m5!1sChdDSUhNMG9nS0VJQ0FnSUMwajhfOXNRRRAB!2m1!1s0x0:0xabe0d94410baf545!3m1!1s2@1:CIHM0ogKEICAgIC0j8_9sQE%7CCgsI6Jqh6QUQiPaLOQ%7C?hl=en","","5","Generally clean If you have an appointment, the examination will be quick and the security will be good","1","956","Minhhang Pen","https://www.google.com/maps/contrib/118160397008376440697?hl=en","118160397008376440697","3","https://lh3.googleusercontent.com/a-/ALV-UjVE-lPxbTXXBQH4POuSnxiSfQ63vXSd5hfkSNxebvFNPGH7v4XgWw=s120-c-rp-mo-br100",,"0x0:0xabe0d94410baf545","2024-05-03 10:03:46.639244+00","https://www.google.com/maps/place/Becamex+International+Hospital/@10.9040943,106.5656015,12z/data=!4m12!1m2!2m1!1zYuG7h25oIHZp4buHbiBiw6xuaCBkxrDGoW5n!3m8!1s0x3174d78fe8d9a42d:0xabe0d94410baf545!8m2!3d10.9040943!4d106.7097971!9m1!1b1!15sChti4buHbmggdmnhu4duIGLDrG5oIGTGsMahbmdaHSIbYuG7h25oIHZp4buHbiBiw6xuaCBkxrDGoW5nkgEIaG9zcGl0YWyaASRDaGREU1VoTk1HOW5TMFZKUTBGblNVUmxORGd5UW1oQlJSQULgAQA!16s%2Fg%2F11fm7f7c8k?entry=ttu","most_relevant","English (United States)"
"8041473","result","292","12385137861630555461","ChZDSUhNMG9nS0VJQ0FnSUMtN1BEaVVREAE","f","vi","Google","ChIJLaTZ6I_XdDERRfW6EETZ4Ks","Becamex International Hospital","a year ago","2022-10-29 05:18:54.335976+00","","2.9","https://www.google.com/maps/reviews/data=!4m8!14m7!1m6!2m5!1sChZDSUhNMG9nS0VJQ0FnSUMtN1BEaVVREAE!2m1!1s0x0:0xabe0d94410baf545!3m1!1s2@1:CIHM0ogKEICAgIC-7PDiUQ%7CCgwIvu_ymgYQwKyaoAE%7C?hl=en","","2","The security guard's service attitude is too bad, paying customers for the examination is not free, the security guard acts like someone's father, talking bossily.","1","956","juan chen","https://www.google.com/maps/contrib/109207731421644246317?hl=en","109207731421644246317","1","https://lh3.googleusercontent.com/a/ACg8ocLS7eMx0xV_O7CeVvX6kVgW72Oog1MJvON14e20UXyX6OmLFA=s120-c-rp-mo-br100",,"0x0:0xabe0d94410baf545","2024-05-03 10:03:46.911843+00","https://www.google.com/maps/place/Becamex+International+Hospital/@10.9040943,106.5656015,12z/data=!4m12!1m2!2m1!1zYuG7h25oIHZp4buHbiBiw6xuaCBkxrDGoW5n!3m8!1s0x3174d78fe8d9a42d:0xabe0d94410baf545!8m2!3d10.9040943!4d106.7097971!9m1!1b1!15sChti4buHbmggdmnhu4duIGLDrG5oIGTGsMahbmdaHSIbYuG7h25oIHZp4buHbiBiw6xuaCBkxrDGoW5nkgEIaG9zcGl0YWyaASRDaGREU1VoTk1HOW5TMFZKUTBGblNVUmxORGd5UW1oQlJSQULgAQA!16s%2Fg%2F11fm7f7c8k?entry=ttu","most_relevant","English (United States)"
"8041474","result","293","12385137861630555461","ChdDSUhNMG9nS0VJQ0FnSUNHNktpX2hBRRAB","f","vi","Google","ChIJLaTZ6I_XdDERRfW6EETZ4Ks","Becamex International Hospital","2 years ago","2021-10-19 05:30:57.214151+00","https://lh5.googleusercontent.com/p/AF1QipPmqPRJpPp8NPi8YIPaZtpPq33mR8U1pIFTo532","2.9","https://www.google.com/maps/reviews/data=!4m8!14m7!1m6!2m5!1sChdDSUhNMG9nS0VJQ0FnSUNHNktpX2hBRRAB!2m1!1s0x0:0xabe0d94410baf545!3m1!1s2@1:CIHM0ogKEICAgICG6Ki_hAE%7CCgsIkbC5iwYQ2N6OZg%7C?hl=en","","5","A clean and beautiful environment with a team of dedicated, friendly and professional medical staff ❤️❤️❤️❤️❤️❤️","0","956","Hạnh Chu","https://www.google.com/maps/contrib/102433796260547997639?hl=en","102433796260547997639","2","https://lh3.googleusercontent.com/a/ACg8ocIJ_JjX4-0lvo3OueJ7mZyhPN7REYsupwbFSYXeGUG_n7OPdQ=s120-c-rp-mo-br100",,"0x0:0xabe0d94410baf545","2024-05-03 10:03:47.217724+00","https://www.google.com/maps/place/Becamex+International+Hospital/@10.9040943,106.5656015,12z/data=!4m12!1m2!2m1!1zYuG7h25oIHZp4buHbiBiw6xuaCBkxrDGoW5n!3m8!1s0x3174d78fe8d9a42d:0xabe0d94410baf545!8m2!3d10.9040943!4d106.7097971!9m1!1b1!15sChti4buHbmggdmnhu4duIGLDrG5oIGTGsMahbmdaHSIbYuG7h25oIHZp4buHbiBiw6xuaCBkxrDGoW5nkgEIaG9zcGl0YWyaASRDaGREU1VoTk1HOW5TMFZKUTBGblNVUmxORGd5UW1oQlJSQULgAQA!16s%2Fg%2F11fm7f7c8k?entry=ttu","most_relevant","English (United States)"
